{
  "context": null,
  "notes": "No unrelated changes.",
  "output_kind": "consolidated",
  "artifacts": {
    "requirements": {
      "ref": ".docs/specs/example/requirements.md",
      "version": 1
    },
    "design": {
      "ref": ".docs/specs/example/design.md",
      "version": 1
    },
    "tasks": {
      "ref": ".docs/specs/example/tasks.md",
      "version": 2
    }
  },
  "artifact_changes": [],
  "changed_files": [
    "src/example.py"
  ],
  "new_files": [
    "tests/test_example.py"
  ],
  "deleted_files": [],
  "cli_runs": [
    "python -m unittest"
  ],
  "test_results": {
    "unit_tests": {
      "status": "pass",
      "details": "The relevant behavioral checks passed."
    },
    "integration_tests": {
      "status": "pass",
      "details": "The relevant behavioral checks passed."
    }
  },
  "checks": [
    {
      "name": "behavioral-tests",
      "status": "pass",
      "required": true,
      "details": "Expected result and preservation witness passed.",
      "disposition_ref": null
    }
  ],
  "implementation_details": "Implemented and verified the approved input behavior.",
  "task_progress": [
    {
      "task_id": "1",
      "status": "completed",
      "evidence": "Behavioral witness passes.",
      "disposition_ref": null
    }
  ],
  "blockers": [],
  "dispositions": [],
  "causes": [],
  "cumulative_scope": [
    "src/example.py",
    "tests/test_example.py"
  ],
  "evidence": [
    {
      "sources": [
        {
          "ref": "src/example.py",
          "context": "Feature baseline and current working changes inspected"
        }
      ],
      "observations": [
        "The implemented branch meets the approved acceptance criterion."
      ],
      "inferences": [],
      "coverage_gaps": [],
      "uncertainty": [],
      "assumptions": [
        "The approved deployment remains local."
      ],
      "freshness": "new",
      "applicability_check": "Compared relevant source content and deployment assumptions with the prior inspection."
    }
  ],
  "checkpoint_commit": null
}
