{
  "context": {
    "trigger_event_id": "17",
    "role": "Coder",
    "attempt": 1,
    "context_id": "coder-P2",
    "configuration_ref": "2"
  },
  "checkpoint_commit": "bbbbbbbbbbbbbbbbbbbbbbbbbbbbbbbbbbbbbbbb",
  "notes": "No unrelated changes.",
  "output_kind": "consolidated",
  "artifacts": {
    "requirements": {
      "ref": ".docs/specs/example/requirements.md",
      "version": 1
    },
    "design": {
      "ref": ".docs/specs/example/design.md",
      "version": 1
    },
    "tasks": {
      "ref": ".docs/specs/example/tasks.md",
      "version": 1
    }
  },
  "artifact_changes": [
    {
      "artifact": "tasks",
      "previous_version": 1,
      "current_version": 1,
      "change_kind": "progress",
      "summary": "Mark task 1 complete.",
      "rationale": "The behavioral witness passed.",
      "approval_basis_ref": {
        "event_id": "8",
        "kind": "approval"
      }
    }
  ],
  "changed_files": [
    "src/example.py"
  ],
  "new_files": [
    "tests/test_example.py"
  ],
  "deleted_files": [],
  "cli_runs": [
    "python -m unittest"
  ],
  "test_results": {
    "unit_tests": {
      "status": "pass",
      "details": "The relevant behavioral checks passed."
    },
    "integration_tests": {
      "status": "pass",
      "details": "The relevant behavioral checks passed."
    }
  },
  "checks": [
    {
      "name": "behavioral-tests",
      "status": "pass",
      "required": true,
      "details": "Expected result and preservation witness passed.",
      "disposition_ref": null
    }
  ],
  "implementation_details": "Implemented and verified the approved input behavior.",
  "task_progress": [
    {
      "task_id": "1",
      "status": "completed",
      "evidence": "Assigned behavioral and integration checks pass.",
      "disposition_ref": null
    },
    {
      "task_id": "2",
      "status": "completed",
      "evidence": "Assigned behavioral and integration checks pass.",
      "disposition_ref": null
    },
    {
      "task_id": "3",
      "status": "completed",
      "evidence": "Assigned behavioral and integration checks pass.",
      "disposition_ref": null
    },
    {
      "task_id": "4",
      "status": "completed",
      "evidence": "Assigned behavioral and integration checks pass.",
      "disposition_ref": null
    },
    {
      "task_id": "5",
      "status": "completed",
      "evidence": "Assigned behavioral and integration checks pass.",
      "disposition_ref": null
    }
  ],
  "blockers": [],
  "dispositions": [],
  "causes": [
    {
      "event_id": "14",
      "kind": "change_wrapper"
    }
  ],
  "cumulative_scope": [
    "src/example.py",
    "tests/test_example.py"
  ],
  "evidence": [
    {
      "sources": [
        {
          "ref": "src/example.py",
          "context": "Feature baseline and current working changes inspected"
        }
      ],
      "observations": [
        "The implemented branch meets the approved acceptance criterion."
      ],
      "inferences": [],
      "coverage_gaps": [],
      "uncertainty": [],
      "assumptions": [
        "The approved deployment remains local."
      ],
      "freshness": "new",
      "applicability_check": "Compared relevant source content and deployment assumptions with the prior inspection."
    }
  ],
  "work_scope": {
    "kind": "feature"
  }
}
